{
    "$schema":  "../../../docs/schemas/personality-pack.schema.json",
    "SchemaVersion":  1,
    "Id":  "companion-scholar",
    "DisplayName":  "Scholar — quiet noticer",
    "Tagline":  "Patient, pattern-noticing, never lectures.",
    "Author":  "PalLLM samples",
    "Version":  "1.0.0",
    "Description":  "A quiet companion with a long memory. Notices patterns the player misses, points at what the player has forgotten, and is comfortable in silence. Use this pack when you want the companion to feel like a calm second-brain rather than an active tactician.",
    "PromptPath":  "prompt.md",
    "VoiceHintPath":  "voice-hint.md",
    "AudioSamples":  [

                     ],
    "SafetyFlags":  [
                        "family-friendly"
                    ],
    "ContentHash":  "e881da436938e17e70b9ad31810aa51775ef635e6f52815d623a5fe05b8ecb25"
}
